<?xml version="1.0" encoding="UTF-8"?><openmensa version="2.0" xmlns="http://openmensa.org/open-mensa-v2" xmlns:xsi="http://www.w3.org/2001/XMLSchema-instance" xsi:schemaLocation="http://openmensa.org/open-mensa-v2 http://openmensa.org/open-mensa-v2.xsd"><canteen><day date="2012-09-03"><category name="Hauptgerichte"><meal><name>Putenbrust </name><note>Gefl체gel</note><price role="employee">2.50</price><price role="other">3.20</price><price role="student">1.45</price></meal><meal><name>Wirsingkohlroulade </name><note>Schwein</note><note>mit Phosphat</note><price role="employee">2.40</price><price role="other">3.10</price><price role="student">1.35</price></meal></category><category name="Beilagen"><meal><name>H채hnchengeschnetzeltes </name><note>Gefl체gel</note><price role="employee">2.50</price><price role="other">3.20</price><price role="student">1.45</price></meal><meal><name>Asiatische Gem체sepfanne mit Tofu und Glasnudeln</name><note>vegan</note><price role="employee">3.70</price><price role="other">4.75</price><price role="student">2.10</price></meal></category></day></canteen></openmensa>
