<?xml version="1.0" encoding="UTF-8"?>
<openmensa version="2.0" xmlns="http://openmensa.org/open-mensa-v2" xmlns:xsi="http://www.w3.org/2001/XMLSchema-instance" xsi:schemaLocation="http://openmensa.org/open-mensa-v2 http://openmensa.org/open-mensa-v2.xsd"><canteen><day date="2012-09-03">
	<category name="Wahlmen端 (Suppe)"><meal><name>Kartoffelsuppe mit Lauch</name></meal><meal><name>Kartoffelsuppe mit Lauch</name></meal></category>
	<category name="Wahlmen端 (Beilage)"><meal><name>Tagesangebot</name></meal></category>
	<category name="Wahlmen端 (Gem端se)"><meal><name>Tagesangebot</name></meal></category>
</day></canteen></openmensa>
